{
    "name": "Cornell Box",
    "transforms": [
      {
        "name": "camera",
        "position": [ 0.0, 1.0, 6.8 ],
        "rotation": [ 0, 180.0, 180.0 ],
        "scale": [ -1.0, 1.0, 1.0 ]
      }
    ],
    "cameras": [
      {
        "name": "default",
        "type": "perspective",
        "fov": 19.5,
        "transform": "camera"
      }
    ],
    "materials": [
      {
        "name": "ShortBox",
        "baseColor": {
          "type": "rgb",
          "value": [1, 1, 1]
        }
      }
    ],
    "objects": [
      {
        "name": "mesh6",
        "material": "ShortBox",
        "type": "trimesh",
        "indices": [
          0,
          2,
          1,
          0,
          3,
          2,
          4,
          6,
          5,
          4,
          7,
          6,
          8,
          10,
          9,
          8,
          11,
          10,
          12,
          14,
          13,
          12,
          15,
          14,
          16,
          18,
          17,
          16,
          19,
          18,
          20,
          22,
          21,
          20,
          23,
          22
        ],
        "vertices": [
          -0.0460751, 0.6, 0.573007,
          -0.0460751, -2.98023e-08, 0.573007,
          0.124253, 0.0, 0.00310463,
          0.124253, 0.6, 0.00310463,
          0.533009, 0.0, 0.746079,
          0.533009, 0.6, 0.746079,
          0.703337, 0.6, 0.176177,
          0.703337, 2.98023e-08, 0.176177,
          0.533009, 0.6, 0.746079,
          -0.0460751, 0.6, 0.573007,
          0.124253, 0.6, 0.00310463,
          0.703337, 0.6, 0.176177,
          0.703337, 2.98023e-08, 0.176177,
          0.124253, 0.0, 0.00310463,
          -0.0460751, -2.98023e-08, 0.573007,
          0.533009, 0.0, 0.746079,
          0.533009, 0.0, 0.746079,
          -0.0460751, -2.98023e-08, 0.573007,
          -0.0460751, 0.6, 0.573007,
          0.533009, 0.6, 0.746079,
          0.703337, 0.6, 0.176177,
          0.124253, 0.6, 0.00310463,
          0.124253, 0.0, 0.00310463,
          0.703337, 2.98023e-08, 0.176177
        ],
        "normals": [
          -0.958123, -4.18809e-08, -0.286357,
          -0.958123, -4.18809e-08, -0.286357,
          -0.958123, -4.18809e-08, -0.286357,
          -0.958123, -4.18809e-08, -0.286357,
          0.958123, 4.18809e-08, 0.286357,
          0.958123, 4.18809e-08, 0.286357,
          0.958123, 4.18809e-08, 0.286357,
          0.958123, 4.18809e-08, 0.286357,
          -4.37114e-08, 1.0, -1.91069e-15,
          -4.37114e-08, 1.0, -1.91069e-15,
          -4.37114e-08, 1.0, -1.91069e-15,
          -4.37114e-08, 1.0, -1.91069e-15,
          4.37114e-08, -1.0, 1.91069e-15,
          4.37114e-08, -1.0, 1.91069e-15,
          4.37114e-08, -1.0, 1.91069e-15,
          4.37114e-08, -1.0, 1.91069e-15,
          -0.286357, -1.25171e-08, 0.958123,
          -0.286357, -1.25171e-08, 0.958123,
          -0.286357, -1.25171e-08, 0.958123,
          -0.286357, -1.25171e-08, 0.958123,
          0.286357, 1.25171e-08, -0.958123,
          0.286357, 1.25171e-08, -0.958123,
          0.286357, 1.25171e-08, -0.958123,
          0.286357, 1.25171e-08, -0.958123
        ],
        "uv": [
          0.0,
          0.0,
          1.0,
          0.0,
          1.0,
          1.0,
          0.0,
          1.0,
          0.0,
          0.0,
          1.0,
          0.0,
          1.0,
          1.0,
          0.0,
          1.0,
          0.0,
          0.0,
          1.0,
          0.0,
          1.0,
          1.0,
          0.0,
          1.0,
          0.0,
          0.0,
          1.0,
          0.0,
          1.0,
          1.0,
          0.0,
          1.0,
          0.0,
          0.0,
          1.0,
          0.0,
          1.0,
          1.0,
          0.0,
          1.0,
          0.0,
          0.0,
          1.0,
          0.0,
          1.0,
          1.0,
          0.0,
          1.0
        ]
      }
    ]
  }